{
  "id": "skoda-superb-3-1-4-tsi-dsg",
  "name": "Skoda Superb 3 1.4 TSI DSG",
  "tag": "oto: 7 ileri ISLAK DSG (DQ250) · 150hp",
  "brand_group": "Skoda",
  "years": "2015-2019",
  "specs": {
    "hp": 150,
    "displacement_l": 1.4,
    "fuel": "Benzin",
    "drivetrain": "Önden",
    "transmission_type": "Islak DCT",
    "transmission_id": "vag-dq250",
    "body_type": "Sedan",
    "engine_id": "vag-ea211",
    "kerb_weight_kg": 1395,
    "torque_nm": 250,
    "fuel_consumption_l_100km": 5.2
  },
  "price_band_k_try": [
    950,
    1400
  ],
  "verification": "partial",
  "scores": {
    "motor": 72,
    "trans": 62,
    "fun": 45,
    "comf": 62,
    "age": 63,
    "cost": 72,
    "liq": 66
  },
  "sources": [
    "andcetin_dq200",
    "kroniksorunlar_superb",
    "oreateai_ea111_vs_ea211"
  ],
  "note": "Superb 3'ün 2.0 TDI'siyle aynı gövdede sunulan 1.4 TSI seçeneği; 150hp/250Nm tork bandı, listede Passat B8 1.4 TSI ve Tiguan 1.4 TSI DSG'de zaten kayıtlı olan aynı ıslak DQ250 eşleşmesini gerektiriyor (kuru DQ200'ün tork sınırının üstünde). Motor EA211 ailesinin (vag-ea211) silindir devre dışı bırakma (ACT) özellikli en güçlü üyesi.",
  "provenance": {
    "added_at": "2026-08-07",
    "method": "Y-01 onuncu tur: VAG grubunda kapsanmayan hacim/nesil kombinasyonu, var olan aileye dikkatle eşleştirilerek eklendi. Teknik özellikler genel üretici verilerine dayanıyor."
  },
  "evidence": {
    "motor": {
      "band": "sağlam, bilinen küçük bakım kalemi var",
      "confidence": "düşük",
      "sources": [
        "oreateai_ea111_vs_ea211"
      ],
      "reasoning": "EA211 (vag-ea211) motor ailesinin temel puanı 72. Bu aracın motor puanı (72) temel puanla birebir aynı. Bu puan 'sağlam, bilinen küçük bakım kalemi var' bandına giriyor: En az bir kaynakta rutin ama planlanabilir bir bakım kalemi bildiriliyor (conta, filtre gibi); motoru komple bitiren bir tasarım hatası yok.",
      "assessed_at": "2026-08-07"
    },
    "trans": {
      "band": "tekrarlayan ama yönetilebilir şikayet",
      "confidence": "orta",
      "sources": [
        "andcetin_dq200",
        "kroniksorunlar_superb"
      ],
      "reasoning": "DQ250 (vag-dq250) şanzıman ailesinin temel puanı 62. Bu aracın trans puanı (62) temel puanla birebir aynı. Bu puan 'tekrarlayan ama yönetilebilir şikayet' bandına giriyor: Kaynaklarda tekrarlayan bir şikayet örüntüsü var (ör. düşük hızda sarsıntı) ama bu felaket bir arıza değil, kutunun kendisi genelde ayakta kalıyor.",
      "assessed_at": "2026-08-07"
    },
    "fun": {
      "band": "sönük",
      "confidence": "düşük",
      "sources": [],
      "reasoning": "Güç/ağırlık oranı 108 hp/ton (normalize 41/100), tork/ağırlık oranı 179 Nm/ton (normalize 39/100); ikisinin %75/%25 ağırlıklı ortalaması (tork payı düşük tutuldu; gerekçesi bütün araçlara aynı şekilde uygulanan sabit bir metodoloji kararı, bkz. docs/ARCHITECTURE.md MK-17) ve çekiş tipi/şanzıman tepkisi düzeltmeleriyle (çekiş +0, şanzıman +4) temel puan 45. Karakter düzeltmesi uygulanmadı: araç PLAN.md §3.6'nın kabul ettiği beş ölçütten (arkadan itiş, sıralı altı silindir, doğal emişli yüksek devir, sportif şasi, direksiyon geri bildirimi) hiçbirini veri tabanında kayıtlı, doğrulanabilir bir olguyla karşılamıyor. Puan elle verilmedi; scripts/compute_fun.py tarafından hesaplandı ve aynı girdi her zaman aynı çıktıyı üretir. Formülün kendisi elle verilmiş puanlara karşı test edildi (docs/ARCHITECTURE.md ilgili MK kaydına bakınız); sportif şasi kurulumu ve direksiyon geri bildirimi verisi eksik olduğu için sezgi payı beklenenden (PLAN.md §3: ~%35) yüksek kalabilir.",
      "assessed_at": "2026-08-07"
    }
  }
}
