{
  "id": "volvo-s80-2-0-d",
  "legacy_index": 93,
  "name": "Volvo S80 2.0 D",
  "tag": "Aisin Geartronic · ~136-181 bg",
  "brand_group": "Volvo",
  "years": "2010-2016",
  "specs": {
    "hp": 163,
    "displacement_l": 2,
    "fuel": "Dizel",
    "drivetrain": "Önden",
    "transmission_type": "TK",
    "transmission_id": "aisin-geartronic",
    "body_type": "Sedan",
    "engine_id": "volvo-d-20"
  },
  "price_band_k_try": [
    700,
    1000
  ],
  "verification": "partial",
  "scores": {
    "motor": 78,
    "trans": 88,
    "fun": 60,
    "comf": 85,
    "age": 58,
    "cost": 69,
    "liq": 46
  },
  "sources": [
    "volvod",
    "volvops"
  ],
  "note": "Volvo'nun büyük sedanı; konforu bu listenin en iyilerinden. Sağlam dizel motoru ve Aisin Geartronic kutusunu kullanıyor. Daha az bulunuyor ve büyük gövdesi şehir içinde biraz yorabiliyor, ama uzun yol için çok rahat.",
  "provenance": {
    "imported_from": "legacy/arac-puanlama-v1.html",
    "imported_at": "2026-08-04",
    "method": "scripts/import_legacy.js"
  },
  "evidence": {
    "motor": {
      "band": "sağlam, bilinen küçük bakım kalemi var",
      "confidence": "orta",
      "sources": [
        "volvod",
        "volvops"
      ],
      "reasoning": "D5204T (volvo-d-20) motor ailesinin temel puanı 70. Bu aracın motor puanı (78), temel puandan 8 puan yukarı sapıyor (bu farkın kayıtlı bir gerekçesi yoksa küçük bir değerlendirme payı olarak kabul ediliyor, ±15 puan sınırı içinde). Ailenin bilinen zaafı: Enjektör arızası, EGR valfi karbon tıkanması, turbo gecikmesi/arızası. Bu puan 'sağlam, bilinen küçük bakım kalemi var' bandına giriyor: En az bir kaynakta rutin ama planlanabilir bir bakım kalemi bildiriliyor (conta, filtre gibi); motoru komple bitiren bir tasarım hatası yok.",
      "assessed_at": "2026-08-06"
    },
    "trans": {
      "band": "temiz",
      "confidence": "orta",
      "sources": [
        "volvod",
        "volvops"
      ],
      "reasoning": "Aisin Geartronic (aisin-geartronic) şanzıman ailesinin temel puanı 78. Bu aracın trans puanı (88), temel puandan 10 puan yukarı sapıyor (bu farkın kayıtlı bir gerekçesi yoksa küçük bir değerlendirme payı olarak kabul ediliyor, ±15 puan sınırı içinde). Bu puan 'temiz' bandına giriyor: İki bağımsız kaynakta kronik arıza kaydı yok ve kutu tipi tork konvertörü ya da düşük torkla eşleşen ıslak çift kavrama.",
      "assessed_at": "2026-08-06"
    }
  }
}
