{
  "id": "volvo-s60-1-5-t3",
  "legacy_index": 1,
  "name": "Volvo S60 1.5 T3",
  "tag": "oto: Aisin Geartronic · ~152hp",
  "brand_group": "Volvo",
  "years": "2015-2018",
  "specs": {
    "hp": 152,
    "displacement_l": 1.5,
    "fuel": "Benzin",
    "drivetrain": "Önden",
    "transmission_type": "TK",
    "transmission_id": "aisin-geartronic",
    "body_type": "Sedan",
    "engine_id": "volvo-vea-benzin"
  },
  "price_band_k_try": [
    750,
    1100
  ],
  "verification": "partial",
  "scores": {
    "motor": 72,
    "trans": 80,
    "fun": 52,
    "comf": 78,
    "age": 60,
    "cost": 62,
    "liq": 40
  },
  "sources": [
    "volvops",
    "teknikotomatik_aisin_6ileri"
  ],
  "note": "VEA ailesinden 1.5 litrelik benzinli motor, Aisin Geartronic otomatikle geliyor. Yaklaşık 152 beygir üretiyor, torku ise orta seviyede kalıyor. Sade ve dert çıkarmayan bir benzinli arıyorsanız mantıklı bir tercih; ayrıca şanzımanı güvenli tarafta.",
  "provenance": {
    "imported_from": "legacy/arac-puanlama-v1.html",
    "imported_at": "2026-08-04",
    "method": "scripts/import_legacy.js"
  },
  "evidence": {
    "motor": {
      "band": "sağlam, bilinen küçük bakım kalemi var",
      "confidence": "orta",
      "sources": [
        "volvops",
        "teknikotomatik_aisin_6ileri"
      ],
      "reasoning": "VEA (volvo-vea-benzin) motor ailesinin temel puanı 60. Bu aracın motor puanı (72), temel puandan 12 puan yukarı sapıyor (bu farkın kayıtlı bir gerekçesi yoksa küçük bir değerlendirme payı olarak kabul ediliyor, ±15 puan sınırı içinde). Ailenin bilinen zaafı: Bazı örneklerde triger kayışının kopup motoru tamamen bitirmesi. Bu puan 'sağlam, bilinen küçük bakım kalemi var' bandına giriyor: En az bir kaynakta rutin ama planlanabilir bir bakım kalemi bildiriliyor (conta, filtre gibi); motoru komple bitiren bir tasarım hatası yok.",
      "assessed_at": "2026-08-06"
    },
    "trans": {
      "band": "yönetilebilir bakım kalemi",
      "confidence": "orta",
      "sources": [
        "volvops",
        "teknikotomatik_aisin_6ileri"
      ],
      "reasoning": "Aisin Geartronic (aisin-geartronic) şanzıman ailesinin temel puanı 78. Bu aracın trans puanı (80), temel puandan 2 puan yukarı sapıyor (bu farkın kayıtlı bir gerekçesi yoksa küçük bir değerlendirme payı olarak kabul ediliyor, ±15 puan sınırı içinde). Bu puan 'yönetilebilir bakım kalemi' bandına giriyor: Kutu sağlam ama düzenli bir bakım kalemi (ör. periyodik yağ değişimi) bildiriliyor; bu kalem atlanmazsa sorun çıkmıyor.",
      "assessed_at": "2026-08-06"
    },
    "age": {
      "band": "TÜV yaş-kusur eğrisinden hesaplandı",
      "confidence": "yüksek",
      "sources": [
        "tuv_report_yas_kusur_egrisi"
      ],
      "reasoning": "Bu aracın model yılı ortalaması 2016.5, yani 2026 itibarıyla yaşı yaklaşık 9.5 yıl. TÜV'ün yaklaşık 9,5 milyon muayeneye dayanan yaş-kusur eğrisine göre bu yaştaki bir araçta ciddi kusur bulunma olasılığı yüzde 20.7. Bu oran, TÜV'ün kendi uç bantları çapa alınarak (yüzde 6,45 kusur = 90 puan, yüzde 40,3 kusur = 20 puan) 60 puana çevrildi. Puan elle verilmedi; scripts/compute_age.py tarafından hesaplandı ve aynı girdi her zaman aynı çıktıyı üretir.",
      "assessed_at": "2026-08-07"
    }
  }
}
