{
  "id": "fiat-egea-1-4-otomatik",
  "name": "Fiat Egea 1.4 Fire Otomatik",
  "tag": "oto: ETG · 95hp",
  "brand_group": "Fiat",
  "years": "2019-2023",
  "specs": {
    "hp": 95,
    "displacement_l": 1.4,
    "fuel": "Benzin",
    "drivetrain": "Önden",
    "transmission_type": "Robot",
    "transmission_id": "psa-etg",
    "body_type": "Sedan",
    "engine_id": "fca-fire-14",
    "kerb_weight_kg": 1150,
    "torque_nm": 127,
    "fuel_consumption_l_100km": 5.7
  },
  "price_band_k_try": [
    560,
    820
  ],
  "verification": "verified",
  "scores": {
    "motor": 76,
    "trans": 38,
    "fun": 3,
    "comf": 60,
    "age": 80,
    "cost": 70,
    "liq": 70
  },
  "sources": [
    "autopartswd_fiat_fire",
    "drivisual_fire14_taxi",
    "ecotorque_psa_etg_aktuator",
    "trbox"
  ],
  "note": "Egea'nın robotlu benzinli sürümü; Türkiye'nin en yaygın aracının en ucuz otomatik seçeneği, ama kutu tipi listenin en zayıf grubunda.",
  "provenance": {
    "added_at": "2026-08-07",
    "method": "Y-01 yedinci tur: bütçe segmenti genişletmesi. Aday autoevolution veri setinden süzüldü (MK-15), motor/şanzıman ailesi elle eşlendi, teknik özellikler veri setinden alındı.",
    "specs_source": "Teknik özellikler (ağırlık, tork, tüketim) autoevolution.com verisinden alındı; eşleşen kayıt: fiat tipo egea 2015 present — 1.4L 6MT FWD (95 HP). Eşleme marka, model, motor hacmi, beygir ve üretim yılı birlikte doğrulanarak yapıldı (MK-15)."
  },
  "evidence": {
    "fun": {
      "band": "sürüş keyfi öncelik değil",
      "confidence": "düşük",
      "sources": [],
      "reasoning": "Güç/ağırlık oranı 83 hp/ton (normalize 14/100), tork/ağırlık oranı 110 Nm/ton (normalize 1/100); ikisinin %75/%25 ağırlıklı ortalaması (tork payı düşük tutuldu; gerekçesi bütün araçlara aynı şekilde uygulanan sabit bir metodoloji kararı, bkz. docs/ARCHITECTURE.md MK-17) ve çekiş tipi/şanzıman tepkisi düzeltmeleriyle (çekiş +0, şanzıman -8) temel puan 3. Karakter düzeltmesi uygulanmadı: araç PLAN.md §3.6'nın kabul ettiği beş ölçütten (arkadan itiş, sıralı altı silindir, doğal emişli yüksek devir, sportif şasi, direksiyon geri bildirimi) hiçbirini veri tabanında kayıtlı, doğrulanabilir bir olguyla karşılamıyor. Puan elle verilmedi; scripts/compute_fun.py tarafından hesaplandı ve aynı girdi her zaman aynı çıktıyı üretir. Formülün kendisi elle verilmiş puanlara karşı test edildi (docs/ARCHITECTURE.md ilgili MK kaydına bakınız); sportif şasi kurulumu ve direksiyon geri bildirimi verisi eksik olduğu için sezgi payı beklenenden (PLAN.md §3: ~%35) yüksek kalabilir.",
      "assessed_at": "2026-08-07"
    },
    "age": {
      "band": "TÜV yaş-kusur eğrisinden hesaplandı",
      "confidence": "yüksek",
      "sources": [
        "tuv_report_yas_kusur_egrisi"
      ],
      "reasoning": "Bu aracın model yılı ortalaması 2021.0, yani 2026 itibarıyla yaşı yaklaşık 5.0 yıl. TÜV'ün yaklaşık 9,5 milyon muayeneye dayanan yaş-kusur eğrisine göre bu yaştaki bir araçta ciddi kusur bulunma olasılığı yüzde 11.1. Bu oran, TÜV'ün kendi uç bantları çapa alınarak (yüzde 6,45 kusur = 90 puan, yüzde 40,3 kusur = 20 puan) 80 puana çevrildi. Puan elle verilmedi; scripts/compute_age.py tarafından hesaplandı ve aynı girdi her zaman aynı çıktıyı üretir.",
      "assessed_at": "2026-08-07"
    }
  }
}
