{
  "id": "rover-75-2-0",
  "legacy_index": 150,
  "name": "Rover 75 2.0",
  "tag": "5 ileri tork konvertörü · ~150hp",
  "brand_group": "Rover",
  "years": "1999-2005",
  "specs": {
    "hp": 150,
    "displacement_l": 2,
    "fuel": "Benzin",
    "drivetrain": "Önden",
    "transmission_type": "TK",
    "transmission_id": "jatco-jf506e",
    "body_type": "Sedan",
    "engine_id": "rover-kv6"
  },
  "price_band_k_try": [
    420,
    620
  ],
  "verification": "partial",
  "scores": {
    "motor": 56,
    "trans": 44,
    "fun": 62,
    "comf": 78,
    "age": 30,
    "cost": 42,
    "liq": 32
  },
  "sources": [
    "techturkey_rover75_yardim",
    "mgrover_rover75_jatco",
    "honestjohn_rover75_auto"
  ],
  "note": "Kabin kalitesi ve yol konforu fiyatının çok üstünde, ama otomatiği ciddi bir risk: kutu Jatco JF506E ve Land Rover Freelander ile Jaguar X-Type'ın da paylaştığı bu kutuda sarsıntılı vites geçişi, sensör kaynaklı arıza kodları, geri vites arızası ve bazı örneklerde tüm vitelerde güç kaybı bildiriliyor. Markanın Türkiye'deki yedek parça ve usta ağının zaten dar olması, bir arıza durumunda çözümü ayrıca zorlaştırıyor.",
  "provenance": {
    "imported_from": "legacy/arac-puanlama-v1.html",
    "imported_at": "2026-08-04",
    "method": "scripts/import_legacy.js"
  },
  "evidence": {
    "motor": {
      "band": "orta risk, izlenmesi gereken kalem var",
      "confidence": "düşük",
      "sources": [
        "techturkey_rover75_yardim",
        "mgrover_rover75_jatco",
        "honestjohn_rover75_auto"
      ],
      "reasoning": "KV6 (rover-kv6) motor ailesinin temel puanı 44. Bu aracın motor puanı (56), temel puandan 12 puan yukarı sapıyor (bu farkın kayıtlı bir gerekçesi yoksa küçük bir değerlendirme payı olarak kabul ediliyor, ±15 puan sınırı içinde). Ailenin bilinen zaafı: Silindir kapağının arka tarafında conta arızası, yüksek kilometrede ve sıcak iklimde daha sık. Bu puan 'orta risk, izlenmesi gereken kalem var' bandına giriyor: Kaynaklarda tekrarlayan ama aracın kullanım biçimine göre değişen bir risk bildiriliyor (ör. yağ tüketimi, turbo hortumu); motor genelde onarılabilir kalıyor.",
      "assessed_at": "2026-08-06"
    },
    "trans": {
      "band": "bilinen risk, kavrama/mekatronik odaklı",
      "confidence": "düşük",
      "sources": [
        "techturkey_rover75_yardim",
        "mgrover_rover75_jatco",
        "honestjohn_rover75_auto"
      ],
      "reasoning": "Jatco JF506E (jatco-jf506e) şanzıman ailesinin temel puanı 44. Bu aracın trans puanı (44) temel puanla birebir aynı. Bu puan 'bilinen risk, kavrama/mekatronik odaklı' bandına giriyor: En az bir kaynak, kavrama aşınması veya mekatronik arızasının düşük-orta kilometrede görüldüğünü doğruluyor.",
      "assessed_at": "2026-08-06"
    }
  }
}
