{
  "id": "renault-laguna-1-9-dci",
  "name": "Renault Laguna 1.9 dCi",
  "tag": "oto: 4 ileri TK (AL4) · 120hp",
  "brand_group": "Renault",
  "years": "2001-2007",
  "specs": {
    "hp": 120,
    "displacement_l": 1.9,
    "fuel": "Dizel",
    "drivetrain": "Önden",
    "transmission_type": "TK",
    "transmission_id": "psa-al4",
    "body_type": "Sedan",
    "engine_id": "renault-f9q",
    "kerb_weight_kg": 1360,
    "torque_nm": 300,
    "fuel_consumption_l_100km": 5.7
  },
  "price_band_k_try": [
    300,
    480
  ],
  "verification": "verified",
  "scores": {
    "motor": 62,
    "trans": 40,
    "fun": 31,
    "comf": 76,
    "age": 15,
    "cost": 64,
    "liq": 36
  },
  "sources": [
    "go4trans_dp0",
    "myautoszerviz_f9q",
    "otokokpit_citroen_xsara",
    "trbox"
  ],
  "note": "Laguna 2'nin listede zaten kayıtlı 1.6/2.0 benzinli versiyonuna eşlik eden dizel; motor için yeni bir aile açıldı (renault-f9q) — dönemin Renault-Nissan ortak dizeli, görece güvenilir kabul ediliyor. AL4 otomatik kutusu listede zaten kayıtlı ve düşük puanlı; aracın yaşı artık çok ileri olduğu için genel yıpranma riski yüksek.",
  "provenance": {
    "added_at": "2026-08-06",
    "method": "Beşinci Y-01 turu: kalan sarı/kırmızı adaylar + Subaru (yeni marka) + 2016 sonrası kapsamını büyüten ek 🟢 araçlar.",
    "specs_source": "Teknik özellikler (ağırlık, tork, tüketim) autoevolution.com verisinden alındı; eşleşen kayıt: renault laguna estate — 1.9L dCi 6MT FWD (120 HP). Eşleme marka, model, motor hacmi, beygir ve üretim yılı birlikte doğrulanarak yapıldı (MK-15)."
  },
  "evidence": {
    "motor": {
      "band": "orta risk, izlenmesi gereken kalem var",
      "confidence": "düşük",
      "sources": [
        "myautoszerviz_f9q",
        "otokokpit_citroen_xsara"
      ],
      "reasoning": "F9Q (renault-f9q) motor ailesinin temel puanı 62. Bu aracın motor puanı (62) temel puanla birebir aynı. Ailenin bilinen zaafı: Yakıt basıncı kontrol valfi arızası ve enjektör hatlarında aşınma/kırılma. Bu puan 'orta risk, izlenmesi gereken kalem var' bandına giriyor: Kaynaklarda tekrarlayan ama aracın kullanım biçimine göre değişen bir risk bildiriliyor (ör. yağ tüketimi, turbo hortumu); motor genelde onarılabilir kalıyor.",
      "assessed_at": "2026-08-06"
    },
    "trans": {
      "band": "bilinen risk, kavrama/mekatronik odaklı",
      "confidence": "düşük",
      "sources": [
        "myautoszerviz_f9q",
        "otokokpit_citroen_xsara"
      ],
      "reasoning": "AL4 (psa-al4) şanzıman ailesinin temel puanı 40. Bu aracın trans puanı (40) temel puanla birebir aynı. Bu puan 'bilinen risk, kavrama/mekatronik odaklı' bandına giriyor: En az bir kaynak, kavrama aşınması veya mekatronik arızasının düşük-orta kilometrede görüldüğünü doğruluyor.",
      "assessed_at": "2026-08-06"
    },
    "age": {
      "band": "TÜV yaş-kusur eğrisinden hesaplandı",
      "confidence": "yüksek",
      "sources": [
        "tuv_report_yas_kusur_egrisi"
      ],
      "reasoning": "Bu aracın model yılı ortalaması 2004.0, yani 2026 itibarıyla yaşı yaklaşık 22.0 yıl. TÜV'ün yaklaşık 9,5 milyon muayeneye dayanan yaş-kusur eğrisine göre bu yaştaki bir araçta ciddi kusur bulunma olasılığı yüzde 42.9. Bu oran, TÜV'ün kendi uç bantları çapa alınarak (yüzde 6,45 kusur = 90 puan, yüzde 40,3 kusur = 20 puan) 15 puana çevrildi. Puan elle verilmedi; scripts/compute_age.py tarafından hesaplandı ve aynı girdi her zaman aynı çıktıyı üretir.",
      "assessed_at": "2026-08-07"
    },
    "fun": {
      "band": "sürüş keyfi öncelik değil",
      "confidence": "düşük",
      "sources": [],
      "reasoning": "Güç/ağırlık oranı 88 hp/ton (normalize 20/100), tork/ağırlık oranı 221 Nm/ton (normalize 62/100); ikisinin %75/%25 ağırlıklı ortalaması (tork payı düşük tutuldu; gerekçesi bütün araçlara aynı şekilde uygulanan sabit bir metodoloji kararı, bkz. docs/ARCHITECTURE.md MK-17) ve çekiş tipi/şanzıman tepkisi düzeltmeleriyle (çekiş +0, şanzıman +0) temel puan 31. Karakter düzeltmesi uygulanmadı: araç PLAN.md §3.6'nın kabul ettiği beş ölçütten (arkadan itiş, sıralı altı silindir, doğal emişli yüksek devir, sportif şasi, direksiyon geri bildirimi) hiçbirini veri tabanında kayıtlı, doğrulanabilir bir olguyla karşılamıyor. Puan elle verilmedi; scripts/compute_fun.py tarafından hesaplandı ve aynı girdi her zaman aynı çıktıyı üretir. Formülün kendisi elle verilmiş puanlara karşı test edildi (docs/ARCHITECTURE.md ilgili MK kaydına bakınız); sportif şasi kurulumu ve direksiyon geri bildirimi verisi eksik olduğu için sezgi payı beklenenden (PLAN.md §3: ~%35) yüksek kalabilir.",
      "assessed_at": "2026-08-07"
    }
  }
}
