{
  "id": "honda-accord-2-4-cl9",
  "legacy_index": 51,
  "name": "Honda Accord 2.4 (CL9)",
  "tag": "oto: 5 ileri TK · ~190hp",
  "brand_group": "Honda",
  "years": "2003-2008",
  "specs": {
    "hp": 190,
    "displacement_l": 2.4,
    "fuel": "Benzin",
    "drivetrain": "Önden",
    "transmission_type": "TK",
    "transmission_id": "honda-4at-5at",
    "body_type": "Sedan",
    "engine_id": "honda-k20-k24",
    "kerb_weight_kg": 1530,
    "torque_nm": 220,
    "fuel_consumption_l_100km": 9.4
  },
  "price_band_k_try": [
    500,
    760
  ],
  "verification": "partial",
  "scores": {
    "motor": 84,
    "trans": 80,
    "fun": 68,
    "comf": 74,
    "age": 19,
    "cost": 63,
    "liq": 54
  },
  "sources": [
    "hondatech_k24",
    "truedelta_accord"
  ],
  "note": "Yedinci nesil Accord (CL9/Euro kasası). Aynı K24 motor ve K-serisi otomatik ailesinden; Honda-Tech'teki tamirci teyidi ve TrueDelta verisi burada da geçerli — 4 silindirli K-serisi otomatikler V6'dan çok daha güvenilir. 190 beygirle listenin gizli eğlenceli araçlarından. Yaşı ilerledi, temiz örnek bulmak zorlaşıyor.",
  "provenance": {
    "imported_from": "legacy/arac-puanlama-v1.html",
    "imported_at": "2026-08-04",
    "method": "scripts/import_legacy.js",
    "specs_source": "Teknik özellikler (ağırlık, tork, tüketim) autoevolution.com verisinden alındı; eşleşen kayıt: honda accord sedan us — 2.4L i-VTEC 5AT FWD (190 HP). Eşleme marka, model, motor hacmi, beygir ve üretim yılı birlikte doğrulanarak yapıldı (MK-15)."
  },
  "evidence": {
    "motor": {
      "band": "sağlam, bilinen küçük bakım kalemi var",
      "confidence": "yüksek",
      "sources": [
        "hondatech_k24",
        "truedelta_accord"
      ],
      "reasoning": "K20 (honda-k20-k24) motor ailesinin temel puanı 78. Bu aracın motor puanı (84), temel puandan 6 puan yukarı sapıyor (bu farkın kayıtlı bir gerekçesi yoksa küçük bir değerlendirme payı olarak kabul ediliyor, ±15 puan sınırı içinde). Ailenin bilinen zaafı: Yüksek kilometrede triger zinciri gergisi arızası. Bu puan 'sağlam, bilinen küçük bakım kalemi var' bandına giriyor: En az bir kaynakta rutin ama planlanabilir bir bakım kalemi bildiriliyor (conta, filtre gibi); motoru komple bitiren bir tasarım hatası yok.",
      "assessed_at": "2026-08-06"
    },
    "trans": {
      "band": "yönetilebilir bakım kalemi",
      "confidence": "yüksek",
      "sources": [
        "hondatech_k24",
        "truedelta_accord"
      ],
      "reasoning": "Honda 4 ileri otomatik (honda-4at-5at) şanzıman ailesinin temel puanı 78. Bu aracın trans puanı (80), temel puandan 2 puan yukarı sapıyor (bu farkın kayıtlı bir gerekçesi yoksa küçük bir değerlendirme payı olarak kabul ediliyor, ±15 puan sınırı içinde). Bu puan 'yönetilebilir bakım kalemi' bandına giriyor: Kutu sağlam ama düzenli bir bakım kalemi (ör. periyodik yağ değişimi) bildiriliyor; bu kalem atlanmazsa sorun çıkmıyor.",
      "assessed_at": "2026-08-06"
    },
    "age": {
      "band": "TÜV yaş-kusur eğrisinden hesaplandı",
      "confidence": "yüksek",
      "sources": [
        "tuv_report_yas_kusur_egrisi"
      ],
      "reasoning": "Bu aracın model yılı ortalaması 2005.5, yani 2026 itibarıyla yaşı yaklaşık 20.5 yıl. TÜV'ün yaklaşık 9,5 milyon muayeneye dayanan yaş-kusur eğrisine göre bu yaştaki bir araçta ciddi kusur bulunma olasılığı yüzde 40.6. Bu oran, TÜV'ün kendi uç bantları çapa alınarak (yüzde 6,45 kusur = 90 puan, yüzde 40,3 kusur = 20 puan) 19 puana çevrildi. Puan elle verilmedi; scripts/compute_age.py tarafından hesaplandı ve aynı girdi her zaman aynı çıktıyı üretir.",
      "assessed_at": "2026-08-07"
    }
  }
}
