{
  "id": "volvo-v40-1-6-d2",
  "legacy_index": 5,
  "name": "Volvo V40 1.6 D2",
  "tag": "oto: Powershift · ~115hp",
  "brand_group": "Volvo",
  "years": "2012-2015",
  "specs": {
    "hp": 115,
    "displacement_l": 1.6,
    "fuel": "Dizel",
    "drivetrain": "Önden",
    "transmission_type": "Kuru DCT",
    "transmission_id": "volvo-powershift-kuru"
  },
  "price_band_k_try": [
    700,
    1000
  ],
  "verification": "partial",
  "scores": {
    "motor": 45,
    "trans": 28,
    "fun": 55,
    "comf": 76,
    "age": 72,
    "cost": 71,
    "liq": 70
  },
  "sources": [
    "v40d2",
    "volvops"
  ],
  "note": "V40 gövdesi hafif olduğu için sürmesi keyifli olsa da, 1.6 dizel motor ile Powershift kutunun birleşimi S60’daki riskin aynısını taşıyor. Bu kombinasyondan uzak durun.",
  "provenance": {
    "imported_from": "legacy/arac-puanlama-v1.html",
    "imported_at": "2026-08-04",
    "method": "scripts/import_legacy.js"
  }
}
