{
  "id": "mercedes-clk200-komp",
  "legacy_index": 39,
  "name": "Mercedes CLK200 Komp.",
  "tag": "W209 M111 · 5G · coupe · ~163hp",
  "brand_group": "Mercedes-Benz",
  "years": "1998-2003",
  "specs": {
    "hp": 163,
    "displacement_l": 1.8,
    "fuel": "Benzin",
    "drivetrain": "Arkadan",
    "transmission_type": "TK",
    "transmission_id": "mb-5g-tronic",
    "body_type": "Coupe",
    "engine_id": "mb-m111",
    "torque_nm": 240
  },
  "price_band_k_try": [
    430,
    680
  ],
  "verification": "verified",
  "scores": {
    "motor": 62,
    "trans": 78,
    "fun": 58,
    "comf": 56,
    "age": 15,
    "cost": 70,
    "liq": 46
  },
  "sources": [
    "enginefinder_m111",
    "enginefinder_za_m111",
    "mbclub_m111",
    "mercedesmedic_722_6_conductor",
    "minhsautocare_722_6"
  ],
  "note": "CLK230'un düşük güçlü versiyonu (163 bg), aynı M111 Kompressor ailesinden (esas olarak W208 kasa). Aynı sağlamlık profili geçerli: düzenli bakımla 300.000 km üzeri ömür mümkün, süperşarj birimi kendisi nadiren sorun çıkarıyor. Mütevazı güç, niş bir tercih ama mekanik olarak güvenilir.",
  "provenance": {
    "imported_from": "legacy/arac-puanlama-v1.html",
    "imported_at": "2026-08-04",
    "method": "scripts/import_legacy.js",
    "specs_source": "Tork (240 Nm) 2026-08-13 tarihli P2.1 veri paketinden alındı; eşleme MK-15 kuralına göre marka, model, beygir (163 bg) ve motor hacmi (1.8 L) birlikte doğrulanarak yapıldı, uyuşmayan kayıtlar boş bırakıldı."
  },
  "evidence": {
    "motor": {
      "band": "orta risk, izlenmesi gereken kalem var",
      "confidence": "orta",
      "sources": [
        "enginefinder_m111",
        "mbclub_m111"
      ],
      "reasoning": "M111 (mb-m111) motor ailesinin temel puanı 66. Bu aracın motor puanı (62), temel puandan 4 puan aşağı sapıyor (bu farkın kayıtlı bir gerekçesi yoksa küçük bir değerlendirme payı olarak kabul ediliyor, ±15 puan sınırı içinde). Ailenin bilinen zaafı: Silindir kapağı contasının 75-150 bin km'de gözeneklenip sızdırmaya başlaması. Bu puan 'orta risk, izlenmesi gereken kalem var' bandına giriyor: Kaynaklarda tekrarlayan ama aracın kullanım biçimine göre değişen bir risk bildiriliyor (ör. yağ tüketimi, turbo hortumu); motor genelde onarılabilir kalıyor.",
      "assessed_at": "2026-08-06"
    },
    "trans": {
      "band": "yönetilebilir bakım kalemi",
      "confidence": "orta",
      "sources": [
        "enginefinder_m111",
        "mbclub_m111"
      ],
      "reasoning": "5G-Tronic (mb-5g-tronic) şanzıman ailesinin temel puanı 80. Bu aracın trans puanı (78), temel puandan 2 puan aşağı sapıyor (bu farkın kayıtlı bir gerekçesi yoksa küçük bir değerlendirme payı olarak kabul ediliyor, ±15 puan sınırı içinde). Bu puan 'yönetilebilir bakım kalemi' bandına giriyor: Kutu sağlam ama düzenli bir bakım kalemi (ör. periyodik yağ değişimi) bildiriliyor; bu kalem atlanmazsa sorun çıkmıyor.",
      "assessed_at": "2026-08-06"
    },
    "age": {
      "band": "TÜV yaş-kusur eğrisinden hesaplandı",
      "confidence": "yüksek",
      "sources": [
        "tuv_report_yas_kusur_egrisi"
      ],
      "reasoning": "Bu aracın model yılı ortalaması 2000.5, yani 2026 itibarıyla yaşı yaklaşık 25.5 yıl. TÜV'ün yaklaşık 9,5 milyon muayeneye dayanan yaş-kusur eğrisine göre bu yaştaki bir araçta ciddi kusur bulunma olasılığı yüzde 42.9. Bu oran, TÜV'ün kendi uç bantları çapa alınarak (yüzde 6,45 kusur = 90 puan, yüzde 40,3 kusur = 20 puan) 15 puana çevrildi. Puan elle verilmedi; scripts/compute_age.py tarafından hesaplandı ve aynı girdi her zaman aynı çıktıyı üretir.",
      "assessed_at": "2026-08-07"
    }
  }
}
