{
  "id": "vw-polo-6-1-0-tsi-dsg",
  "name": "VW Polo 6 1.0 TSI DSG",
  "tag": "oto: 7 ileri kuru DSG · 95hp",
  "brand_group": "Volkswagen",
  "years": "2018-2021",
  "specs": {
    "hp": 95,
    "displacement_l": 1.0,
    "fuel": "Benzin",
    "drivetrain": "Önden",
    "transmission_type": "Kuru DCT",
    "transmission_id": "vag-dq200",
    "body_type": "Hatchback",
    "engine_id": "vag-ea211"
  },
  "price_band_k_try": [
    750,
    1100
  ],
  "verification": "partial",
  "scores": {
    "motor": 72,
    "trans": 38,
    "fun": 52,
    "comf": 72,
    "age": 74,
    "cost": 70,
    "liq": 72
  },
  "sources": [
    "sikayetvar_passat_tsi",
    "teknikotomatik_dq200_dq250"
  ],
  "note": "Polo'nun küçük hacimli üç silindirli girişi; EA211 ailesi listede zaten 1.4 TSI olarak kayıtlı, bu araçla birlikte ailenin hacim aralığı 1.0'a genişletildi çünkü EA211 gerçekte 1.0-1.5 litre arasını kapsayan tek bir modüler aile. DQ200 kuru DSG'nin bilinen düşük hızda gecikme eğilimi burada da geçerli.",
  "provenance": {
    "added_at": "2026-08-06",
    "method": "Sarı/kırmızı çeşitlendirme turu: yeni motor/şanzıman ailesi açılarak eklendi."
  },
  "evidence": {
    "motor": {
      "band": "sağlam, bilinen küçük bakım kalemi var",
      "confidence": "orta",
      "sources": [
        "sikayetvar_passat_tsi",
        "teknikotomatik_dq200_dq250"
      ],
      "reasoning": "EA211 (vag-ea211) motor ailesinin temel puanı 72. Bu aracın motor puanı (72) temel puanla birebir aynı. Bu puan 'sağlam, bilinen küçük bakım kalemi var' bandına giriyor: En az bir kaynakta rutin ama planlanabilir bir bakım kalemi bildiriliyor (conta, filtre gibi); motoru komple bitiren bir tasarım hatası yok.",
      "assessed_at": "2026-08-06"
    },
    "trans": {
      "band": "bilinen risk, kavrama/mekatronik odaklı",
      "confidence": "orta",
      "sources": [
        "sikayetvar_passat_tsi",
        "teknikotomatik_dq200_dq250"
      ],
      "reasoning": "DQ200 (vag-dq200) şanzıman ailesinin temel puanı 38. Bu aracın trans puanı (38) temel puanla birebir aynı. Bu puan 'bilinen risk, kavrama/mekatronik odaklı' bandına giriyor: En az bir kaynak, kavrama aşınması veya mekatronik arızasının düşük-orta kilometrede görüldüğünü doğruluyor.",
      "assessed_at": "2026-08-06"
    },
    "age": {
      "band": "TÜV yaş-kusur eğrisinden hesaplandı",
      "confidence": "yüksek",
      "sources": [
        "tuv_report_yas_kusur_egrisi"
      ],
      "reasoning": "Bu aracın model yılı ortalaması 2019.5, yani 2026 itibarıyla yaşı yaklaşık 6.5 yıl. TÜV'ün yaklaşık 9,5 milyon muayeneye dayanan yaş-kusur eğrisine göre bu yaştaki bir araçta ciddi kusur bulunma olasılığı yüzde 14.4. Bu oran, TÜV'ün kendi uç bantları çapa alınarak (yüzde 6,45 kusur = 90 puan, yüzde 40,3 kusur = 20 puan) 74 puana çevrildi. Puan elle verilmedi; scripts/compute_age.py tarafından hesaplandı ve aynı girdi her zaman aynı çıktıyı üretir.",
      "assessed_at": "2026-08-07"
    }
  }
}
