{
  "id": "toyota-auris-1-8-multidrive",
  "name": "Toyota Auris 1.8 Multidrive",
  "tag": "oto: Multidrive CVT · 136hp",
  "brand_group": "Toyota",
  "years": "2013-2018",
  "specs": {
    "hp": 136,
    "displacement_l": 1.8,
    "fuel": "Benzin",
    "drivetrain": "Önden",
    "transmission_type": "CVT",
    "transmission_id": "toyota-multidrive",
    "body_type": "Hatchback",
    "engine_id": "toyota-zr"
  },
  "price_band_k_try": [
    900,
    1250
  ],
  "verification": "partial",
  "scores": {
    "motor": 76,
    "trans": 74,
    "fun": 42,
    "comf": 80,
    "age": 56,
    "cost": 86,
    "liq": 82
  },
  "sources": [
    "teknikotomatiksanziman_multidrive",
    "sikayetvar_corolla_genel"
  ],
  "note": "Auris'in üst güç benzinlisi; ZR motoru (1.8 varyantı) ve Multidrive CVT listede zaten Avensis ve Corolla'da kayıtlı. CVT'nin kayış-kasnak aşınması ve tork konvertörü kayması ihmal edilen bakımda ortaya çıkıyor; yağının 60-80 bin km'de değiştirilmesi öneriliyor. Motor tarafında ciddi bir kronik arıza bildirilmemiş.",
  "provenance": {
    "added_at": "2026-08-06",
    "method": "Motor/şanzıman çeşitlendirme turu: docs/Y01B-MOTOR-CESITLENDIRME.md'deki onaylı 🟢 aday."
  },
  "evidence": {
    "motor": {
      "band": "sağlam, bilinen küçük bakım kalemi var",
      "confidence": "orta",
      "sources": [
        "teknikotomatiksanziman_multidrive",
        "sikayetvar_corolla_genel"
      ],
      "reasoning": "1ZR-FE (toyota-zr) motor ailesinin temel puanı 76. Bu aracın motor puanı (76) temel puanla birebir aynı. Ailenin bilinen zaafı: 2014 ve bazı erken 2015 modellerinde Valvematic aktüatörünün karbon birikimiyle sıkışması, güç kaybı veya çalışmama. Bu puan 'sağlam, bilinen küçük bakım kalemi var' bandına giriyor: En az bir kaynakta rutin ama planlanabilir bir bakım kalemi bildiriliyor (conta, filtre gibi); motoru komple bitiren bir tasarım hatası yok.",
      "assessed_at": "2026-08-06"
    },
    "trans": {
      "band": "yönetilebilir bakım kalemi",
      "confidence": "orta",
      "sources": [
        "teknikotomatiksanziman_multidrive",
        "sikayetvar_corolla_genel"
      ],
      "reasoning": "Multidrive S (toyota-multidrive) şanzıman ailesinin temel puanı 74. Bu aracın trans puanı (74) temel puanla birebir aynı. Bu puan 'yönetilebilir bakım kalemi' bandına giriyor: Kutu sağlam ama düzenli bir bakım kalemi (ör. periyodik yağ değişimi) bildiriliyor; bu kalem atlanmazsa sorun çıkmıyor.",
      "assessed_at": "2026-08-06"
    },
    "age": {
      "band": "TÜV yaş-kusur eğrisinden hesaplandı",
      "confidence": "yüksek",
      "sources": [
        "tuv_report_yas_kusur_egrisi"
      ],
      "reasoning": "Bu aracın model yılı ortalaması 2015.5, yani 2026 itibarıyla yaşı yaklaşık 10.5 yıl. TÜV'ün yaklaşık 9,5 milyon muayeneye dayanan yaş-kusur eğrisine göre bu yaştaki bir araçta ciddi kusur bulunma olasılığı yüzde 22.8. Bu oran, TÜV'ün kendi uç bantları çapa alınarak (yüzde 6,45 kusur = 90 puan, yüzde 40,3 kusur = 20 puan) 56 puana çevrildi. Puan elle verilmedi; scripts/compute_age.py tarafından hesaplandı ve aynı girdi her zaman aynı çıktıyı üretir.",
      "assessed_at": "2026-08-07"
    }
  }
}
