{
  "id": "opel-corsa-d-1-4-otomatik",
  "name": "Opel Corsa D 1.4 Otomatik",
  "tag": "oto: AF17 · 100hp",
  "brand_group": "Opel",
  "years": "2010-2014",
  "specs": {
    "hp": 100,
    "displacement_l": 1.4,
    "fuel": "Benzin",
    "drivetrain": "Önden",
    "transmission_type": "TK",
    "transmission_id": "gm-aisin-af17",
    "body_type": "Hatchback",
    "engine_id": "gm-a14net",
    "kerb_weight_kg": 1200,
    "torque_nm": 201,
    "fuel_consumption_l_100km": 5.3
  },
  "price_band_k_try": [
    420,
    650
  ],
  "verification": "partial",
  "scores": {
    "motor": 58,
    "trans": 68,
    "fun": 19,
    "comf": 60,
    "age": 42,
    "cost": 70,
    "liq": 70
  },
  "sources": [
    "asrgearbox_tf80",
    "autodoc_astra_j_problems",
    "cherishyourcar_a14net"
  ],
  "note": "Corsa D'nin dört ileri tork konvertörlü sürümü; şehir içi kullanımda sağlam ama yakıt tüketimi yüksek.",
  "provenance": {
    "added_at": "2026-08-07",
    "method": "Y-01 yedinci tur: bütçe segmenti genişletmesi. Aday autoevolution veri setinden süzüldü (MK-15), motor/şanzıman ailesi elle eşlendi, teknik özellikler veri setinden alındı.",
    "specs_source": "Teknik özellikler (ağırlık, tork, tüketim) autoevolution.com verisinden alındı; eşleşen kayıt: opel corsa 5 doors — 1.4L ecoFLEX 6MT FWD (100 HP). Eşleme marka, model, motor hacmi, beygir ve üretim yılı birlikte doğrulanarak yapıldı (MK-15)."
  },
  "evidence": {
    "fun": {
      "band": "sürüş keyfi öncelik değil",
      "confidence": "düşük",
      "sources": [],
      "reasoning": "Güç/ağırlık oranı 83 hp/ton (normalize 15/100), tork/ağırlık oranı 168 Nm/ton (normalize 33/100); ikisinin %75/%25 ağırlıklı ortalaması (tork payı düşük tutuldu; gerekçesi bütün araçlara aynı şekilde uygulanan sabit bir metodoloji kararı, bkz. docs/ARCHITECTURE.md MK-17) ve çekiş tipi/şanzıman tepkisi düzeltmeleriyle (çekiş +0, şanzıman +0) temel puan 19. Karakter düzeltmesi uygulanmadı: araç PLAN.md §3.6'nın kabul ettiği beş ölçütten (arkadan itiş, sıralı altı silindir, doğal emişli yüksek devir, sportif şasi, direksiyon geri bildirimi) hiçbirini veri tabanında kayıtlı, doğrulanabilir bir olguyla karşılamıyor. Puan elle verilmedi; scripts/compute_fun.py tarafından hesaplandı ve aynı girdi her zaman aynı çıktıyı üretir. Formülün kendisi elle verilmiş puanlara karşı test edildi (docs/ARCHITECTURE.md ilgili MK kaydına bakınız); sportif şasi kurulumu ve direksiyon geri bildirimi verisi eksik olduğu için sezgi payı beklenenden (PLAN.md §3: ~%35) yüksek kalabilir.",
      "assessed_at": "2026-08-07"
    },
    "age": {
      "band": "TÜV yaş-kusur eğrisinden hesaplandı",
      "confidence": "yüksek",
      "sources": [
        "tuv_report_yas_kusur_egrisi"
      ],
      "reasoning": "Bu aracın model yılı ortalaması 2012.0, yani 2026 itibarıyla yaşı yaklaşık 14.0 yıl. TÜV'ün yaklaşık 9,5 milyon muayeneye dayanan yaş-kusur eğrisine göre bu yaştaki bir araçta ciddi kusur bulunma olasılığı yüzde 29.5. Bu oran, TÜV'ün kendi uç bantları çapa alınarak (yüzde 6,45 kusur = 90 puan, yüzde 40,3 kusur = 20 puan) 42 puana çevrildi. Puan elle verilmedi; scripts/compute_age.py tarafından hesaplandı ve aynı girdi her zaman aynı çıktıyı üretir.",
      "assessed_at": "2026-08-07"
    }
  }
}
