{
  "id": "peugeot-2008-1-6-thp",
  "name": "Peugeot 2008 1.6 THP",
  "tag": "oto: 4 ileri TK (AL4) · 156hp",
  "brand_group": "Peugeot",
  "years": "2014-2017",
  "specs": {
    "hp": 156,
    "displacement_l": 1.6,
    "fuel": "Benzin",
    "drivetrain": "Önden",
    "transmission_type": "TK",
    "transmission_id": "psa-al4",
    "body_type": "SUV",
    "engine_id": "psa-ep6-thp"
  },
  "price_band_k_try": [
    750,
    1100
  ],
  "verification": "verified",
  "scores": {
    "motor": 46,
    "trans": 40,
    "fun": 58,
    "comf": 68,
    "age": 56,
    "cost": 68,
    "liq": 66
  },
  "sources": [
    "enginescope_ep6_thp",
    "go4trans_dp0",
    "otokokpit_citroen_xsara",
    "sikayetvar_peugeot_2008",
    "trbox",
    "teknikotomatik_al4_dpo"
  ],
  "note": "2008'in ilk nesli (208 platformu); EP6 THP turbo motoru ve eski 4 ileri AL4 otomatiği listede zaten kayıtlı, ikisi de düşük puanlı bileşenler (motor triger zinciri, kutu genel olarak eski tasarım). Cam kriko motoru arızaları ve bazı araçlarda vites geçiş sorunları bildirilmiş; triger zinciri kontrolü ve şanzıman bakım geçmişi satın almadan önce mutlaka sorulmalı.",
  "provenance": {
    "added_at": "2026-08-06",
    "method": "Y-01 hedef listesi A/B bölümü: WebSearch ile araştırılmış, docs/Y01-HEDEF-LISTE.md'de önceden onaylanmış aday."
  },
  "evidence": {
    "motor": {
      "band": "yüksek risk, tanımlı bir tasarım hatası var",
      "confidence": "orta",
      "sources": [
        "sikayetvar_peugeot_2008",
        "otokokpit_citroen_xsara"
      ],
      "reasoning": "EP6DT (psa-ep6-thp) motor ailesinin temel puanı 46. Bu aracın motor puanı (46) temel puanla birebir aynı. Ailenin bilinen zaafı: Triger zincirinin erken uzaması; 2016 öncesi üretimde 100.000 km'ye nadiren ulaşıyor, ilk belirtiler ~60.000 km'de. Bu puan 'yüksek risk, tanımlı bir tasarım hatası var' bandına giriyor: En az bir kaynak, düşük-orta kilometrede ortaya çıkan ve motoru ağır onarıma götüren bilinen bir tasarım hatasını doğruluyor (ör. arka triger zinciri).",
      "assessed_at": "2026-08-06"
    },
    "trans": {
      "band": "bilinen risk, kavrama/mekatronik odaklı",
      "confidence": "orta",
      "sources": [
        "sikayetvar_peugeot_2008",
        "otokokpit_citroen_xsara"
      ],
      "reasoning": "AL4 (psa-al4) şanzıman ailesinin temel puanı 40. Bu aracın trans puanı (40) temel puanla birebir aynı. Bu puan 'bilinen risk, kavrama/mekatronik odaklı' bandına giriyor: En az bir kaynak, kavrama aşınması veya mekatronik arızasının düşük-orta kilometrede görüldüğünü doğruluyor.",
      "assessed_at": "2026-08-06"
    },
    "age": {
      "band": "TÜV yaş-kusur eğrisinden hesaplandı",
      "confidence": "yüksek",
      "sources": [
        "tuv_report_yas_kusur_egrisi"
      ],
      "reasoning": "Bu aracın model yılı ortalaması 2015.5, yani 2026 itibarıyla yaşı yaklaşık 10.5 yıl. TÜV'ün yaklaşık 9,5 milyon muayeneye dayanan yaş-kusur eğrisine göre bu yaştaki bir araçta ciddi kusur bulunma olasılığı yüzde 22.8. Bu oran, TÜV'ün kendi uç bantları çapa alınarak (yüzde 6,45 kusur = 90 puan, yüzde 40,3 kusur = 20 puan) 56 puana çevrildi. Puan elle verilmedi; scripts/compute_age.py tarafından hesaplandı ve aynı girdi her zaman aynı çıktıyı üretir.",
      "assessed_at": "2026-08-07"
    }
  }
}
