{
  "id": "opel-insignia-2-0-turbo",
  "name": "Opel Insignia 2.0 Turbo",
  "tag": "oto: 4 ileri TK (Aisin AF40) · 220hp",
  "brand_group": "Opel",
  "years": "2009-2013",
  "specs": {
    "hp": 220,
    "displacement_l": 2.0,
    "fuel": "Benzin",
    "drivetrain": "Önden",
    "transmission_type": "TK",
    "transmission_id": "aisin-af40",
    "body_type": "Sedan",
    "engine_id": "gm-a20net"
  },
  "price_band_k_try": [
    350,
    550
  ],
  "verification": "partial",
  "scores": {
    "motor": 46,
    "trans": 58,
    "fun": 64,
    "comf": 78,
    "age": 30,
    "cost": 54,
    "liq": 38
  },
  "sources": [
    "dhaber_insignia_2_0_turbo",
    "teknikotomatik_aisin_6ileri"
  ],
  "note": "Insignia'nın üst güç benzinli versiyonu; motor için yeni bir aile açıldı (gm-a20net) — listede zaten kayıtlı dizel A20DTH ile aynı gövdeyi paylaşan ama tamamen ayrı bir benzinli aile. Ateşleme bobini aşınması ve turbo hortum yırtılması (~50.000 km) tekrarlayan şikayetler; Aisin AF40 kutusu listede zaten kayıtlı.",
  "provenance": {
    "added_at": "2026-08-06",
    "method": "Beşinci Y-01 turu: kalan sarı/kırmızı adaylar + Subaru (yeni marka) + 2016 sonrası kapsamını büyüten ek 🟢 araçlar."
  }
}
