{
  "id": "skoda-superb-3-2-0-tdi",
  "name": "Skoda Superb 3 2.0 TDI",
  "tag": "oto: 6 ileri ıslak DSG · 150hp",
  "brand_group": "Skoda",
  "years": "2015-2019",
  "specs": {
    "hp": 150,
    "displacement_l": 2.0,
    "fuel": "Dizel",
    "drivetrain": "Önden",
    "transmission_type": "Islak DCT",
    "transmission_id": "vag-dq250",
    "body_type": "Sedan",
    "engine_id": "vag-ea288",
    "kerb_weight_kg": 1555,
    "torque_nm": 340
  },
  "price_band_k_try": [
    1050,
    1500
  ],
  "verification": "verified",
  "scores": {
    "motor": 76,
    "trans": 62,
    "fun": 41,
    "comf": 88,
    "age": 63,
    "cost": 78,
    "liq": 70
  },
  "sources": [
    "andcetin_dq200",
    "ecotorque_dq250_mekatronik",
    "enginefinders_ea288_20tdi",
    "kroniksorunlar_superb",
    "sikayetvar_a4_tfsi",
    "teknikotomatik_dq200_dq250",
    "torquecars_ea288_avoid_problems"
  ],
  "note": "Superb'in üçüncü ve listede ilk kez yer alan nesli (önceki Superb 2 kaydı listede zaten var); EA288 2.0 TDI ve ıslak DQ250 kutusu listede zaten kayıtlı. Mekatronik şanzıman arızaları ikinci elde bildirilmiş; bazı 2020 model araçlarda kontak açılışında motor sarsıntısı/stop etme şikayeti var. Fiyat/donanım dengesi segmentinin üstünde değerlendiriliyor.",
  "provenance": {
    "added_at": "2026-08-06",
    "method": "Motor/şanzıman çeşitlendirme turu: docs/Y01B-MOTOR-CESITLENDIRME.md'deki onaylı 🟢 aday.",
    "specs_source": "Teknik özellikler (ağırlık, tork, tüketim) autoevolution.com verisinden alındı; eşleşen kayıt: skoda superb — 2.0L TDI 6MT FWD (150 HP). Eşleme marka, model, motor hacmi, beygir ve üretim yılı birlikte doğrulanarak yapıldı (MK-15)."
  },
  "evidence": {
    "motor": {
      "band": "sağlam, bilinen küçük bakım kalemi var",
      "confidence": "orta",
      "sources": [
        "sikayetvar_a4_tfsi",
        "teknikotomatik_dq200_dq250"
      ],
      "reasoning": "EA288 (vag-ea288) motor ailesinin temel puanı 76. Bu aracın motor puanı (76) temel puanla birebir aynı. Bu puan 'sağlam, bilinen küçük bakım kalemi var' bandına giriyor: En az bir kaynakta rutin ama planlanabilir bir bakım kalemi bildiriliyor (conta, filtre gibi); motoru komple bitiren bir tasarım hatası yok.",
      "assessed_at": "2026-08-06"
    },
    "trans": {
      "band": "tekrarlayan ama yönetilebilir şikayet",
      "confidence": "orta",
      "sources": [
        "sikayetvar_a4_tfsi",
        "teknikotomatik_dq200_dq250"
      ],
      "reasoning": "DQ250 (vag-dq250) şanzıman ailesinin temel puanı 62. Bu aracın trans puanı (62) temel puanla birebir aynı. Bu puan 'tekrarlayan ama yönetilebilir şikayet' bandına giriyor: Kaynaklarda tekrarlayan bir şikayet örüntüsü var (ör. düşük hızda sarsıntı) ama bu felaket bir arıza değil, kutunun kendisi genelde ayakta kalıyor.",
      "assessed_at": "2026-08-06"
    },
    "age": {
      "band": "TÜV yaş-kusur eğrisinden hesaplandı",
      "confidence": "yüksek",
      "sources": [
        "tuv_report_yas_kusur_egrisi"
      ],
      "reasoning": "Bu aracın model yılı ortalaması 2017.0, yani 2026 itibarıyla yaşı yaklaşık 9.0 yıl. TÜV'ün yaklaşık 9,5 milyon muayeneye dayanan yaş-kusur eğrisine göre bu yaştaki bir araçta ciddi kusur bulunma olasılığı yüzde 19.7. Bu oran, TÜV'ün kendi uç bantları çapa alınarak (yüzde 6,45 kusur = 90 puan, yüzde 40,3 kusur = 20 puan) 63 puana çevrildi. Puan elle verilmedi; scripts/compute_age.py tarafından hesaplandı ve aynı girdi her zaman aynı çıktıyı üretir.",
      "assessed_at": "2026-08-07"
    },
    "fun": {
      "band": "sönük",
      "confidence": "düşük",
      "sources": [],
      "reasoning": "Güç/ağırlık oranı 96 hp/ton (normalize 29/100), tork/ağırlık oranı 219 Nm/ton (normalize 61/100); ikisinin %75/%25 ağırlıklı ortalaması (tork payı düşük tutuldu; gerekçesi bütün araçlara aynı şekilde uygulanan sabit bir metodoloji kararı, bkz. docs/ARCHITECTURE.md MK-17) ve çekiş tipi/şanzıman tepkisi düzeltmeleriyle (çekiş +0, şanzıman +4) temel puan 41. Karakter düzeltmesi uygulanmadı: araç PLAN.md §3.6'nın kabul ettiği beş ölçütten (arkadan itiş, sıralı altı silindir, doğal emişli yüksek devir, sportif şasi, direksiyon geri bildirimi) hiçbirini veri tabanında kayıtlı, doğrulanabilir bir olguyla karşılamıyor. Puan elle verilmedi; scripts/compute_fun.py tarafından hesaplandı ve aynı girdi her zaman aynı çıktıyı üretir. Formülün kendisi elle verilmiş puanlara karşı test edildi (docs/ARCHITECTURE.md ilgili MK kaydına bakınız); sportif şasi kurulumu ve direksiyon geri bildirimi verisi eksik olduğu için sezgi payı beklenenden (PLAN.md §3: ~%35) yüksek kalabilir.",
      "assessed_at": "2026-08-07"
    }
  }
}
